{
  "lock_version": 1,
  "toolchain": {
    "mojo": "1.0.0"
  },
  "channels": [
    "https://conda.mopm.dev/"
  ],
  "packages": [
    {
      "name": "crypto",
      "version": "2.0.1",
      "build": "mojo1.0.0_0",
      "subdir": "linux-64",
      "channel": "https://conda.mopm.dev/",
      "url": "https://conda.mopm.dev/linux-64/mojo-crypto-2.0.1-mojo1.0.0_0.conda",
      "sha256": "9f86d081884c7d659a2feaa0c55ad015a3bf4f1b2b0b822cd15d6c15b0f00a08",
      "size": 1000,
      "mojo": "1.0.0",
      "native": [
        {
          "id": "crypto",
          "soname": "libcrypto_native.so.1",
          "sha256": "5feceb66ffc86f38d952786c6d696c79c2dbc239dd4e91b46729d73a27fb57e9"
        }
      ]
    },
    {
      "name": "http_client",
      "version": "0.4.0",
      "build": "mojo1.0.0_0",
      "subdir": "linux-64",
      "channel": "https://conda.mopm.dev/",
      "url": "https://conda.mopm.dev/linux-64/mojo-http_client-0.4.0-mojo1.0.0_0.conda",
      "sha256": "2c26b46b68ffc68ff99b453c1d30413413422d706483bfa0f98a5e886266e7ae",
      "size": 1000,
      "mojo": "1.0.0",
      "deps": [
        "crypto",
        "http_core"
      ]
    },
    {
      "name": "http_core",
      "version": "1.2.5",
      "build": "mojo1.0.0_0",
      "subdir": "linux-64",
      "channel": "https://conda.mopm.dev/",
      "url": "https://conda.mopm.dev/linux-64/mojo-http_core-1.2.5-mojo1.0.0_0.conda",
      "sha256": "fcde2b2edba56bf408601fb721fe9b5c338d10ee429ea04fae5511b68fbf8fb9",
      "size": 1000,
      "mojo": "1.0.0"
    }
  ]
}
