{
  "lock_version": 1,
  "toolchain": {
    "mojo": "1.0.0"
  },
  "channels": [
    "https://conda.mopm.dev/"
  ],
  "packages": [
    {
      "name": "http_core",
      "version": "1.2.5",
      "build": "mojo1.0.0_0",
      "subdir": "linux-64",
      "channel": "https://conda.mopm.dev/",
      "url": "https://conda.mopm.dev/linux-64/mojo-http_core-1.2.5-mojo1.0.0_0.conda",
      "sha256": "fcde2b2edba56bf408601fb721fe9b5c338d10ee429ea04fae5511b68fbf8fb9",
      "size": 1000,
      "mojo": "1.0.0"
    },
    {
      "name": "http_core",
      "version": "1.2.5",
      "build": "mojo1.0.0_0",
      "subdir": "osx-arm64",
      "channel": "https://conda.mopm.dev/",
      "url": "https://conda.mopm.dev/osx-arm64/mojo-http_core-1.2.5-mojo1.0.0_0.conda",
      "sha256": "5feceb66ffc86f38d952786c6d696c79c2dbc239dd4e91b46729d73a27fb57e9",
      "size": 1000,
      "mojo": "1.0.0"
    }
  ]
}
